{
  "behavior_groups": [
    {
      "description": "LLVM coverage JSON conversion, filtering, counters, and CLI failures.",
      "id": "converter.llvm"
    },
    {
      "description": "Devel::Cover conversion, exclusions, checksums, and CLI failures.",
      "id": "converter.perl"
    },
    {
      "description": "Coverage.py conversion, legacy input, exclusions, checksums, and CLI failures.",
      "id": "converter.python"
    },
    {
      "description": "Cobertura XML conversion, version callbacks, aggregation, and CLI failures.",
      "id": "converter.xml"
    },
    {
      "description": "GCC and LLVM MC/DC capture, conversion, filtering, merge, and report behavior.",
      "id": "coverage.mcdc"
    },
    {
      "description": "HTML reports for synthetic zero, partial, target, and full coverage rates.",
      "id": "genhtml.coverage-rates"
    },
    {
      "description": "C++ demangler command and argument behavior during report generation.",
      "id": "genhtml.demangling"
    },
    {
      "description": "Shared CLI diagnostics, config inclusion, ignore handling, and callback failures.",
      "id": "genhtml.diagnostics-and-config"
    },
    {
      "description": "Exception coverage and baseline/current differential report behavior.",
      "id": "genhtml.exception-differential"
    },
    {
      "description": "Function extents, aliases, versions, and baseline/current categorization.",
      "id": "genhtml.function-differential"
    },
    {
      "description": "Lambda function extents and display in HTML reports.",
      "id": "genhtml.lambda-display"
    },
    {
      "description": "Case-insensitive source paths, annotations, versions, and merge behavior.",
      "id": "genhtml.path-case"
    },
    {
      "description": "Relative source paths and report output path resolution.",
      "id": "genhtml.relative-paths"
    },
    {
      "description": "General HTML layout, callbacks, navigation, thresholds, and report options.",
      "id": "genhtml.report-options"
    },
    {
      "description": "Synthesis and rejection of missing or inconsistent tracefile coverpoints.",
      "id": "genhtml.tracefile-synthesis"
    },
    {
      "description": "Capture CLI help, errors, compatibility modes, recursion, temp paths, and initial capture.",
      "id": "geninfo.capture-cli"
    },
    {
      "description": "Tracefile addition, input ordering, pruning, and function mapping.",
      "id": "lcov.add-and-prune"
    },
    {
      "description": "GCC branch capture, filtering, merging, and source-level branch identities.",
      "id": "lcov.branch-coverage"
    },
    {
      "description": "Capture paths, markers, callbacks, substitutions, checksums, and source filtering.",
      "id": "lcov.capture-and-filter"
    },
    {
      "description": "Demangling, simplification callbacks, exclusions, and function end lines.",
      "id": "lcov.demangling"
    },
    {
      "description": "Malformed tracefile, consistency, ignore, keep-going, and message-count behavior.",
      "id": "lcov.diagnostics"
    },
    {
      "description": "Exception branch capture and coverage filtering.",
      "id": "lcov.exception-branches"
    },
    {
      "description": "Follow and no-follow source-directory traversal behavior.",
      "id": "lcov.follow-symlinks"
    },
    {
      "description": "Tracefile record parsing, ordering, duplicate handling, and malformed input.",
      "id": "lcov.format"
    },
    {
      "description": "Absolute, relative, missing, and default gcov tool resolution.",
      "id": "lcov.gcov-tool"
    },
    {
      "description": "C++ initializer-list coverage filtering during capture.",
      "id": "lcov.initializer-filter"
    },
    {
      "description": "Lambda function coalescing and derived function extents.",
      "id": "lcov.lambda-filter"
    },
    {
      "description": "Initial capture across multiple directories and case-insensitive paths.",
      "id": "lcov.multi-directory"
    },
    {
      "description": "List, remove, intersect, subtract, package, and kernel-capture paths.",
      "id": "lcov.operations-and-packages"
    },
    {
      "description": "Tracefile union, intersection, subtraction, and generated coverpoints.",
      "id": "lcov.set-operations"
    },
    {
      "description": "Help, version, option parsing, and startup output.",
      "id": "lcov.startup"
    },
    {
      "description": "Text summaries for synthetic and concatenated coverage inputs.",
      "id": "lcov.summary"
    },
    {
      "description": "Source-driven line, branch, directive, brace, and trivial-function filters.",
      "id": "shared.coverage-filter"
    },
    {
      "description": "Batch Git blob-version callback behavior.",
      "id": "support-script.batch-git-version"
    },
    {
      "description": "Git source annotation callback behavior.",
      "id": "support-script.git-annotation"
    },
    {
      "description": "Git revision-diff generation and filtering behavior.",
      "id": "support-script.git-diff"
    },
    {
      "description": "Git source-version callback behavior.",
      "id": "support-script.git-version"
    },
    {
      "description": "Perforce source annotation callback behavior.",
      "id": "support-script.p4-annotation"
    },
    {
      "description": "Perforce revision-diff generation and filtering behavior.",
      "id": "support-script.p4-diff"
    },
    {
      "description": "Perforce source-version callback behavior.",
      "id": "support-script.p4-version"
    },
    {
      "description": "Test cleanup discovery and execution.",
      "id": "test-harness.cleanup"
    },
    {
      "description": "Stable test command, environment, and configuration setup.",
      "id": "test-harness.configuration"
    },
    {
      "description": "Test prerequisite discovery and validation.",
      "id": "test-harness.dependencies"
    },
    {
      "description": "Upstream test-suite documentation.",
      "id": "test-harness.documentation"
    },
    {
      "description": "Test process execution, isolation, and coverage wrapping.",
      "id": "test-harness.execution"
    },
    {
      "description": "Make-based test discovery and orchestration.",
      "id": "test-harness.orchestration"
    },
    {
      "description": "Test logging, result accounting, skips, and resource reporting.",
      "id": "test-harness.results"
    },
    {
      "description": "Generation and validation of synthetic tracefile inputs.",
      "id": "test-harness.synthetic-tracefiles"
    }
  ],
  "entries": [
    {
      "behavior_groups": [
        "test-harness.orchestration"
      ],
      "classification": "internal_test_infrastructure",
      "evidence_scope": "internal_only",
      "owners": [],
      "rationale": "Upstream Makefile that selects or launches tests; it is harness orchestration, not an installed LCOV behavior.",
      "review_status": "reviewed",
      "sha256": "9777e704535e01d169f23d4bf194d0076c6385ab29a4320534aa43e08f3684c8",
      "source": "tests/Makefile",
      "upstream_execution": "not_applicable"
    },
    {
      "behavior_groups": [
        "test-harness.documentation"
      ],
      "classification": "internal_test_infrastructure",
      "evidence_scope": "internal_only",
      "owners": [],
      "rationale": "Upstream test-suite documentation; it describes the harness rather than an installed LCOV behavior.",
      "review_status": "reviewed",
      "sha256": "2cd454cdb7c6fc37d4eab06260699effc46890ee93ceff835268c5edc242831a",
      "source": "tests/README.md",
      "upstream_execution": "not_applicable"
    },
    {
      "behavior_groups": [
        "test-harness.synthetic-tracefiles"
      ],
      "classification": "internal_test_infrastructure",
      "evidence_scope": "internal_only",
      "owners": [],
      "rationale": "Upstream harness utility that validates generated synthetic tracefile counts; it does not exercise an installed LCOV surface by itself.",
      "review_status": "reviewed",
      "sha256": "c7664799aab3940710e748add474d7817b0afe745eb8a62df607f5b2be054cbc",
      "source": "tests/bin/check_counts",
      "upstream_execution": "not_applicable"
    },
    {
      "behavior_groups": [
        "test-harness.dependencies"
      ],
      "classification": "internal_test_infrastructure",
      "evidence_scope": "internal_only",
      "owners": [],
      "rationale": "Upstream harness utility that checks test executable prerequisites; it does not exercise an installed LCOV surface by itself.",
      "review_status": "reviewed",
      "sha256": "d159082f63449ff32b5e459cce3eb26b63bfc5978c5d7459f893f62a9f401688",
      "source": "tests/bin/checkdeps",
      "upstream_execution": "not_applicable"
    },
    {
      "behavior_groups": [
        "test-harness.cleanup"
      ],
      "classification": "internal_test_infrastructure",
      "evidence_scope": "internal_only",
      "owners": [],
      "rationale": "Upstream harness utility that discovers and cleans test targets; it does not exercise an installed LCOV surface by itself.",
      "review_status": "reviewed",
      "sha256": "21c78660130010e94f627d016ae5572455838efe48d8cfaa6b5871ead5d2bf22",
      "source": "tests/bin/cleantests.py",
      "upstream_execution": "not_applicable"
    },
    {
      "behavior_groups": [
        "test-harness.results"
      ],
      "classification": "internal_test_infrastructure",
      "evidence_scope": "internal_only",
      "owners": [],
      "rationale": "Upstream harness utility that provides shared shell logging and result functions; it does not exercise an installed LCOV surface by itself.",
      "review_status": "reviewed",
      "sha256": "d682cd38ac02135832fc8d5da2d01d0df72b8cd268814e3bc3445d59769b05a8",
      "source": "tests/bin/common",
      "upstream_execution": "not_applicable"
    },
    {
      "behavior_groups": [
        "test-harness.results"
      ],